{
  "schema_version": 2,
  "operation": "visual-receipt",
  "task_id": "visual-model-38016554238-v1",
  "artifact_run": "38016554238",
  "visual_receipt": "receipt.json",
  "artifact_name": "review-delivery",
  "files": [
    {
      "role": "visual_receipt",
      "sha256": "9589b3054f453cf212eef262da5a362b55fbe4486d1b8f9469262db00d1ca37e",
      "path": "receipt.json"
    }
  ],
  "engine_commit": "ede3e05309d86f256a8cc0d4121d71df185e36ab"
}