{
  "schema_version": 2,
  "operation": "visual-receipt",
  "task_id": "visual-matrix-38004628757-v1",
  "artifact_run": "38004628757",
  "visual_receipt": "receipt.json",
  "artifact_name": "template-matrix",
  "files": [
    {
      "sha256": "054ac605fc87b5ddd780d8670d1aec48d2d2c1fbecf819aef880d0ed6b659693",
      "role": "visual_receipt",
      "path": "receipt.json"
    }
  ],
  "engine_commit": "8f6bd2d2dc73a2ca9262a1a0455f15cc4afdef59"
}